{
  "scheduled_at": "2026-10-09T06:02:00.000Z",
  "schema_version": 2,
  "slot": 5971752,
  "targets": [
    {
      "checked_at": "2026-10-08T17:22:45.965Z",
      "config_sha256": "4ecd75203bd622ad0ad4c2cbd7467d850724fca627b8449f508e45b99b5f8615",
      "endpoints": [
        {
          "ip": "211.107.180.137",
          "port": 995
        }
      ],
      "id": "v1:6b85a1dd31f4930202c59a9be7bbc720034d452e646dfc7835982c066729c8a5",
      "ip": "211.107.180.137",
      "last_probe_round": 82938,
      "last_seen_at": "2026-10-08T21:59:30.329Z",
      "next_probe_at": "2026-10-08T21:22:45.965Z"
    },
    {
      "checked_at": "2026-10-08T17:22:45.965Z",
      "config_sha256": "225169336cbe076c0d81609eca6ebc2d12c6b65cd4855dc6bfe29be9d5a50d44",
      "endpoints": [
        {
          "ip": "182.164.27.34",
          "port": 1399
        }
      ],
      "id": "v1:707becb1281ac8e267a9a93bb3a024cf29a2d0d1786fb6a7233b09cca1cf986e",
      "ip": "182.164.27.34",
      "last_probe_round": 82938,
      "last_seen_at": "2026-10-08T12:59:33.797Z",
      "next_probe_at": "2026-10-08T21:22:45.965Z"
    },
    {
      "checked_at": "2026-10-08T17:22:45.965Z",
      "config_sha256": "7932c34b09876973b2125aaf0c64d1b9907f3807fe61546d8c3e344a8dfe16c8",
      "endpoints": [
        {
          "ip": "27.121.35.252",
          "port": 1739
        }
      ],
      "id": "v1:70cdeedea229ce9c4581ec366a5a902748f899183c06c06209e87ea08ae2a281",
      "ip": "27.121.35.252",
      "last_probe_round": 82938,
      "last_seen_at": "2026-10-06T12:29:30.041Z",
      "next_probe_at": "2026-10-08T18:22:45.965Z"
    },
    {
      "checked_at": "2026-10-08T17:22:45.965Z",
      "config_sha256": "7fe3ab91a97237eb9bbcac524fd009b9d01513c45bfb602609558752d41a47c2",
      "endpoints": [
        {
          "ip": "47.223.248.100",
          "port": 1584
        }
      ],
      "id": "v1:75424c7c289432415493cfb94c5a978cde05ba503f20a1f65552f49e040d770d",
      "ip": "47.223.248.100",
      "last_probe_round": 82938,
      "last_seen_at": "2026-10-07T05:29:31.121Z",
      "next_probe_at": "2026-10-08T21:22:45.965Z"
    },
    {
      "checked_at": "2026-10-08T17:22:45.965Z",
      "config_sha256": "e7a554ad6441bc5d5fa2be163b12d56ed934419fae7048546887c96295b60a62",
      "endpoints": [
        {
          "ip": "121.168.29.196",
          "port": 1856
        }
      ],
      "id": "v1:798a442e12f48f5e892a818d2e5e7d8d3de7149e8ce8f0dfddf59c3dd076bf02",
      "ip": "121.168.29.196",
      "last_probe_round": 82938,
      "last_seen_at": "2026-10-07T20:29:33.692Z",
      "next_probe_at": "2026-10-08T18:22:45.965Z"
    },
    {
      "checked_at": "2026-10-08T17:22:45.965Z",
      "config_sha256": "abaa252dcb0e46c16b0e42e301c602db9774cd798b70b60ea8f356918219ce2a",
      "endpoints": [
        {
          "ip": "59.23.237.215",
          "port": 1831
        }
      ],
      "id": "v1:7b7b051166123e946a235e6eb054edfa43aa5c934210fac80af4dcb347de2d36",
      "ip": "59.23.237.215",
      "last_probe_round": 82938,
      "last_seen_at": "2026-10-07T04:29:29.862Z",
      "next_probe_at": "2026-10-08T18:22:45.965Z"
    },
    {
      "checked_at": "2026-10-08T17:22:45.965Z",
      "config_sha256": "a51a57a7296de38f2fd6d7d2dc812fe9aef453ad13fcde6717999ef970546530",
      "endpoints": [
        {
          "ip": "1.240.44.87",
          "port": 995
        }
      ],
      "id": "v1:842d4050e7247804da79286bc07066434656789394a612f9f05da2cf602fb114",
      "ip": "1.240.44.87",
      "last_probe_round": 82938,
      "last_seen_at": "2026-10-07T15:59:26.797Z",
      "next_probe_at": "2026-10-08T18:22:45.965Z"
    },
    {
      "checked_at": "2026-10-08T17:22:45.965Z",
      "config_sha256": "6e6924c24af568f481b4803c2e3c353f24bf95767a216271ad43f7113163609c",
      "endpoints": [
        {
          "ip": "133.114.223.195",
          "port": 1519
        }
      ],
      "id": "v1:a0c641f3bc11a67487308a620efaf4fbba120d3aeb011a314989f9d842a56ded",
      "ip": "133.114.223.195",
      "last_probe_round": 82938,
      "last_seen_at": "2026-10-08T12:29:28.995Z",
      "next_probe_at": "2026-10-08T18:22:45.965Z"
    },
    {
      "checked_at": "2026-10-08T17:22:45.965Z",
      "config_sha256": "29a2c3ebd054f85faac2741cf8e946e9138fd8d4e041a79e711732a59f5bc144",
      "endpoints": [
        {
          "ip": "59.135.150.87",
          "port": 1598
        }
      ],
      "id": "v1:b09c4bc5e673c478c2f22f1efec4b6a24ea1f1662f008a76ec5b8a62b5684c39",
      "ip": "59.135.150.87",
      "last_probe_round": 82938,
      "last_seen_at": "2026-10-08T14:59:35.986Z",
      "next_probe_at": "2026-10-08T21:22:45.965Z"
    },
    {
      "checked_at": "2026-10-08T17:22:45.965Z",
      "config_sha256": "4ef7715b8cd0e71cf9c6d778042fe99f74b931ad078e243abd215b62082e717e",
      "endpoints": [
        {
          "ip": "147.47.217.154",
          "port": 1656
        }
      ],
      "id": "v1:b0b5d888ca031edaf868166c850f5e9d7ebdab8e81e5bdfa0dc5f78e57a04c93",
      "ip": "147.47.217.154",
      "last_probe_round": 82938,
      "last_seen_at": "2026-10-08T08:59:30.703Z",
      "next_probe_at": "2026-10-08T21:22:45.965Z"
    },
    {
      "checked_at": "2026-10-08T17:22:45.965Z",
      "config_sha256": "a2937c3111a514e80feae214673cd04181157688173e3d3aa701a9d2fb66e2d5",
      "endpoints": [
        {
          "ip": "117.108.66.173",
          "port": 1442
        }
      ],
      "id": "v1:b7b1231afe81411c54bbedaf51c4137ff6b82510a6418607485a0f0074fec7e3",
      "ip": "117.108.66.173",
      "last_probe_round": 82938,
      "last_seen_at": "2026-10-08T04:59:28.633Z",
      "next_probe_at": "2026-10-08T18:22:45.965Z"
    },
    {
      "checked_at": "2026-10-08T17:22:45.965Z",
      "config_sha256": "91d8619f69e0bf8d2c7af1d85536081b806d7adb9d12ecf9de810b7c5d92b623",
      "endpoints": [
        {
          "ip": "121.180.27.91",
          "port": 1210
        }
      ],
      "id": "v1:bae5cf9f34fdc6d1a52fca3dbe6a649ab34b2df4196554245d53da07015d4e96",
      "ip": "121.180.27.91",
      "last_probe_round": 82938,
      "last_seen_at": "2026-10-08T10:59:30.915Z",
      "next_probe_at": "2026-10-08T18:22:45.965Z"
    },
    {
      "checked_at": "2026-10-08T17:22:45.965Z",
      "config_sha256": "18c0922efbb6f1e5b19d13676f9084518d42f411112be1a1a61d4d517a2b2c6a",
      "endpoints": [
        {
          "ip": "138.199.21.236",
          "port": 1929
        }
      ],
      "id": "v1:c571aa8b83ba893c6043ced7b2319bf64b0bbe8afb493d97f8b472167058cb9e",
      "ip": "138.199.21.236",
      "last_probe_round": 82938,
      "last_seen_at": "2026-10-07T06:29:27.813Z",
      "next_probe_at": "2026-10-08T18:22:45.965Z"
    },
    {
      "checked_at": "2026-10-08T17:27:25.455Z",
      "config_sha256": "08ea6dcb7c8093b645573d8371adcafcc3a985b4656d86cb123265bfb8f5e32b",
      "endpoints": [
        {
          "ip": "42.125.162.163",
          "port": 1521
        }
      ],
      "id": "v1:48dd411beb04d2971641483037a6744ed6cc491a66e77d5ea486a4d2d3c8ce5b",
      "ip": "42.125.162.163",
      "last_probe_round": 82938,
      "last_seen_at": "2026-10-08T09:29:27.948Z",
      "next_probe_at": "2026-10-08T18:27:25.455Z"
    },
    {
      "checked_at": "2026-10-08T17:27:25.455Z",
      "config_sha256": "230490263b2d882ebecd37fe73ab4e71e4440f70ede98c535d4db28c46722f54",
      "endpoints": [
        {
          "ip": "219.100.37.93",
          "port": 443
        }
      ],
      "id": "v1:516ed36ae41449852034ad54c88e2f38644e45fcea7b3bf145594ed4bc51563e",
      "ip": "219.100.37.93",
      "last_probe_round": 82938,
      "last_seen_at": "2026-10-08T19:29:33.981Z",
      "next_probe_at": "2026-10-08T21:27:25.455Z"
    },
    {
      "checked_at": "2026-10-08T17:27:25.455Z",
      "config_sha256": "8212676b82ffbdb7777dc50bbf5dc07208d77721e9f1288c9c9bec8686cc6045",
      "endpoints": [
        {
          "ip": "220.148.61.245",
          "port": 1937
        }
      ],
      "id": "v1:58e8526580ab128a79e0199ebf08482739e6c7b8d8451f8cc9c9bb80a1d5b006",
      "ip": "220.148.61.245",
      "last_probe_round": 82938,
      "last_seen_at": "2026-10-07T04:29:29.862Z",
      "next_probe_at": "2026-10-08T18:27:25.455Z"
    },
    {
      "checked_at": "2026-10-08T17:27:25.455Z",
      "config_sha256": "d9c8981e3e4de7460634ab1212a939364795625c85ddcced3ee58f12212e14c4",
      "endpoints": [
        {
          "ip": "1.240.213.9",
          "port": 995
        }
      ],
      "id": "v1:5992ccf26d99dd2af7899d5d0f5e26fc88d36086c98a087141ac2e00811bb7a8",
      "ip": "1.240.213.9",
      "last_probe_round": 82938,
      "last_seen_at": "2026-10-08T19:29:33.981Z",
      "next_probe_at": "2026-10-08T18:27:25.455Z"
    },
    {
      "checked_at": "2026-10-08T17:27:25.455Z",
      "config_sha256": "2b29653f87ab29042ab5ab9165ed866ab9ab85ebd763af2b771bf705213dfb0a",
      "endpoints": [
        {
          "ip": "210.104.211.222",
          "port": 1927
        }
      ],
      "id": "v1:81b2ee8526f27a28672366aaf70a8dfbeb6eaa199ce9bc1e040669ee89d38b69",
      "ip": "210.104.211.222",
      "last_probe_round": 82938,
      "last_seen_at": "2026-10-05T22:59:30.965Z",
      "next_probe_at": "2026-10-08T21:27:25.455Z"
    },
    {
      "checked_at": "2026-10-08T17:27:25.455Z",
      "config_sha256": "cb8c1ea3fc0bbd27a4f623dc8be1edafcda3155d8a02ef3b0b604cf52877e78c",
      "endpoints": [
        {
          "ip": "183.96.64.207",
          "port": 995
        }
      ],
      "id": "v1:82641a17309026809dfbe17b07ae98e8c9d16015d928aa7170016cbe4a4829fb",
      "ip": "183.96.64.207",
      "last_probe_round": 82938,
      "last_seen_at": "2026-10-08T19:59:29.069Z",
      "next_probe_at": "2026-10-08T18:27:25.455Z"
    },
    {
      "checked_at": null,
      "config_sha256": "54c7fbe565aff8274ba165f2e3b6687ba7fbb29a6a56bc98ec764239365e3f06",
      "endpoints": [
        {
          "ip": "131.147.196.35",
          "port": 1716
        }
      ],
      "id": "v1:0ee51c5027da4d3df722477ba51241fca2bdbad5b2554f2c117336757a5b254d",